{
  "Id": "6bd32882-4b47-4ade-81a6-ccf0dcd29de6",
  "PostedDate": "2025-07-27T23:33:01.5525601Z",
  "JobId": "eyJqb2JfdGl0bGUiOiJEYXRhIEFuYWx5dGljcyBFbmdpbmVlciIsImNvbXBhbnlfbmFtZSI6IkRpc2NvdmVyeSBFZHVjYXRpb24iLCJhZGRyZXNzX2NpdHkiOiJDaGFybG90dGUsIE5DIiwiaHRpZG9jaWQiOiI3ekptSER2eWNIYV9KMDA0QUFBQUFBPT0iLCJ1dWxlIjoidytDQUlRSUNJYVEyaGhjbXh2ZEhSbExFNURMRlZ1YVhSbFpDQlRkR0YwWlhNIiwiaGwiOiJlbiJ9",
  "CompanyId": "Discovery Education",
  "CompanyName": "Discovery Education",
  "HiringAgency": "Built In",
  "JobTitle": "Data Analytics Engineer",
  "Location": "Charlotte, NC",
  "JobDescription": "Discovery Education is looking for a Data Analytics Engineer to join our team to support various areas of the business such as product analytics, product marketing, and customer support and operations. This role will support data-based decision making by modeling data from the data warehouse and cloud storage to support the development of insights for the business teams. The Analytics Engineer will become a specialist in our modern data stack, including Snowflake, dbt, Looker, and Hightouch.\n\nThis role will sit in our Charlotte Headquarters with a hybrid schedule.\n\nAbout the Role\n\u2022 Work collaboratively with data engineers and data scientists to drive business value through turning data models into actionable insights for business stakeholders.\n\u2022 Provide clean, transformed data ready for analysis.\n\u2022 Apply engineering best practices to analytics code.\n\u2022 Maintain data documentation and definitions.\n\u2022 Collaborate with team members to collect business requirements, define successful analytics outcomes, and design data models.\n\u2022 Craft code that meets our internal standards for style, maintainability, and best practices for a high-scale database environment. Maintain and advocate for these standards through code review.\n\u2022 Ability to use Snowflake, dbt, Looker, and git.\n\u2022 Ability to thrive and work with remote colleagues.\n\u2022 Positive and solution-oriented mindset.\n\nRequirements\n\u2022 A minimum of 2-3 years\u0027 experience as an analyst, engineer, data scientist or equivalent.\n\u2022 2\u002B years working with product and customer data.\n\u2022 Demonstrated ability to learn new systems quickly and master data integrity among multiple systems.\n\u2022 3\u002B years using SQL. Experience analyzing data with R or Python or other similar tools a plus.\n\u2022 Experience working with data warehouses, data transformation tools, and writing technical documentation for your work.\n\u2022 Experience using Snowflake and dbt a plus.\n\u2022 Work collaboratively with the data management team; experience with API integrations a plus\n\u2022 Experience working with large data volumes (millions of daily events).\n\u2022 Must have strong interpersonal skills - collaboration across multiple business and technology. functions, relationship building and consensus building are a must.\n\u2022 Must be able to work on and prioritize multiple tasks while working well under pressure.\n\u2022 Legal right to work in the United States.\n\nBenefits\n\nWe are proud to offer employees and their families a comprehensive benefits package:\n\u2022 Medical-Dental-Vision\n\u2022 Health Care Dependent Care\n\u2022 Short \u0026 Long Term Disability\n\u2022 Summer Hours\n\u2022 Life Insurance\n\u2022 401(k)\n\u2022 FSA/HSA\n\u2022 Paid Time Off\n\u2022 Volunteer Time\n\u2022 Employee Assistance Program\n\u2022 7 Paid Holidays \u002B Annual Winter Holiday Break (Typically the last week of December)\n\nDiscovery Education is an equal opportunity employer. Discovery Education is committed to being an employer of choice, not just a good place to work, but a great and inclusive place to work. To that end, we strive to recruit and maintain a workforce that meaningfully represents the diverse and culturally rich communities that we serve. Qualified applicants will receive consideration for employment without regard to their race, color, religion, national origin, sex, sexual orientation, gender identity, protected veteran status or disabled status or, genetic information.\n\nOther details\n\u2022 Pay Type Salary\n\nApply Now",
  "Division": "Data Analytics",
  "Confidence": 85,
  "Reasoning": "The job description primarily revolves around data modeling, analytics, and turning data into actionable insights, which aligns with responsibilities typically handled by a Data Analytics division.",
  "SourceLink": "https://www.google.com/search?ibp=htl;jobs\u0026q=Data\u002BEngineer\u0026htidocid=7zJmHDvycHa_J004AAAAAA%3D%3D\u0026hl=en-US\u0026shndl=37\u0026shmd=H4sIAAAAAAAA_xWMMQ7CMAwAxdonMHlgQpAgJBaYUFshMfCFKg1WmirYVWxQ-w4-TFhuurvqu6pM49TBlVxaNHqBlkIkxAx7uHMPgi77AZjgxhwSri-D6iRna0WSCaKuVMbzyzJhz7MduZc_Ohlcxik5xe54OsxmorDdNFE8fzAv0D7fvrRlHAnq4iZWxR086h_atdGylgAAAA\u0026shmds=v1_AdeF8KjiOtdjDHamRirkft8lchY6aS3OHxiFXjiTKDqKGvWfTQ\u0026source=sh/x/job/li/m1/1#fpstate=tldetail\u0026htivrt=jobs\u0026htiq=Data\u002BEngineer\u0026htidocid=7zJmHDvycHa_J004AAAAAA%3D%3D",
  "SourceName": "Google Jobs",
  "JobHighlights": [
    {
      "title": "Qualifications",
      "items": [
        "Ability to thrive and work with remote colleagues",
        "Positive and solution-oriented mindset",
        "A minimum of 2-3 years\u0027 experience as an analyst, engineer, data scientist or equivalent",
        "2\u002B years working with product and customer data",
        "Demonstrated ability to learn new systems quickly and master data integrity among multiple systems",
        "3\u002B years using SQL",
        "Must have strong interpersonal skills - collaboration across multiple business and technology",
        "functions, relationship building and consensus building are a must",
        "Must be able to work on and prioritize multiple tasks while working well under pressure",
        "Legal right to work in the United States"
      ]
    },
    {
      "title": "Benefits",
      "items": [
        "We are proud to offer employees and their families a comprehensive benefits package:",
        "Medical-Dental-Vision",
        "Health Care Dependent Care",
        "Short \u0026 Long Term Disability",
        "Summer Hours",
        "Life Insurance",
        "401(k)",
        "FSA/HSA",
        "Paid Time Off",
        "Volunteer Time",
        "Employee Assistance Program",
        "7 Paid Holidays \u002B Annual Winter Holiday Break (Typically the last week of December)"
      ]
    },
    {
      "title": "Responsibilities",
      "items": [
        "Discovery Education is looking for a Data Analytics Engineer to join our team to support various areas of the business such as product analytics, product marketing, and customer support and operations",
        "This role will support data-based decision making by modeling data from the data warehouse and cloud storage to support the development of insights for the business teams",
        "The Analytics Engineer will become a specialist in our modern data stack, including Snowflake, dbt, Looker, and Hightouch",
        "Work collaboratively with data engineers and data scientists to drive business value through turning data models into actionable insights for business stakeholders",
        "Provide clean, transformed data ready for analysis",
        "Apply engineering best practices to analytics code",
        "Maintain data documentation and definitions",
        "Collaborate with team members to collect business requirements, define successful analytics outcomes, and design data models",
        "Craft code that meets our internal standards for style, maintainability, and best practices for a high-scale database environment",
        "Maintain and advocate for these standards through code review",
        "Ability to use Snowflake, dbt, Looker, and git",
        "Experience working with data warehouses, data transformation tools, and writing technical documentation for your work",
        "Experience working with large data volumes (millions of daily events)"
      ]
    }
  ],
  "CreatedAt": "2025-07-27T23:33:01.5525608Z",
  "UpdatedAt": "2025-07-27T23:33:01.5525608Z"
}