{
  "Id": "0a86fb7d-e2d4-4375-93fc-7369724524a8",
  "PostedDate": "2025-07-30T07:50:29.8538210-04:00",
  "JobId": "eyJqb2JfdGl0bGUiOiJTZW5pb3IgRGF0YSBFbmdpbmVlciAtIENhcGl0YWwgT25lIFNvZnR3YXJlIChSZW1vdGUpIiwiY29tcGFueV9uYW1lIjoiQ2FwaXRhbCBPbmUiLCJhZGRyZXNzX2NpdHkiOiJBdGxhbnRhLCBHQSIsImh0aWRvY2lkIjoiMjg0SzcxUmk1cVR1b1RrOEFBQUFBQT09IiwidXVsZSI6IncrQ0FJUUlDSWFRMmhoY214dmRIUmxMRTVETEZWdWFYUmxaQ0JUZEdGMFpYTSIsImhsIjoiZW4ifQ==",
  "CompanyId": "edcd98e1e7a9e3690fa9fb9e50afb4be9b6c4c22094a932859b4925f3c200c10",
  "CompanyName": "Capital One",
  "HiringAgency": "JobServe",
  "JobTitle": "Senior Data Engineer - Capital One Software (Remote)",
  "Location": "Atlanta, GA",
  "JobDescription": "Senior Data Engineer - Capital One Software (Remote)\n\nEver since our first credit card customer in 1994, Capital One has recognized that technology and data can enable even large companies to be innovative and personalized. As one of the first large enterprises to go all-in on the public cloud, Capital One needed to build cloud and data management tools that didn\u0027t exist in the marketplace to enable us to operate at scale in the cloud. In 2022, we publicly announced Capital One Software and have since brought two of our B2B software solutions to market; Slingshot and Databolt.\n\nWe are seeking top tier talent to join our pioneering team and propel us towards our destination. You will be joining a team of innovative product, tech, and design leaders that tirelessly seek to question the status quo. As a Capital One Data Engineer you\u0027ll have the opportunity to be on the forefront of building this business and bring these tools to market.\n\nWhat You\u0027ll Do:\n\u2022 Collaborate with and across Agile teams to design, develop, test, implement, and support technical solutions in full-stack development tools and technologies\n\u2022 Work with a team of developers with deep experience in machine learning, distributed microservices, and full stack systems\n\u2022 Utilize programming languages like Java, Scala, Python and Open Source RDBMS and NoSQL databases and Cloud based data warehousing services such as Databricks and Snowflake\n\u2022 Share your passion for staying on top of tech trends, experimenting with and learning new technologies, participating in internal \u0026 external technology communities, and mentoring other members of the engineering community\n\u2022 Collaborate with digital product managers, and deliver robust cloud-based solutions that drive powerful experiences to help millions of Americans achieve financial empowerment\n\u2022 Perform unit tests and conduct reviews with other team members to make sure your code is rigorously designed, elegantly coded, and effectively tuned for performance\n\nBasic Qualifications:\n\u2022 Bachelor\u0027s Degree\n\u2022 At least 3 years of experience in application development (Internship experience does not apply)\n\u2022 At least 1 year of experience in big data technologies\n\nPreferred Qualifications:\n\u2022 5\u002B years of experience in application development including Python, SQL, Scala, or Java\n\u2022 2\u002B years of experience with a public cloud (AWS, Microsoft Azure, Google Cloud)\n\u2022 3\u002B years experience with Distributed data/computing tools (MapReduce, Hadoop, Hive, EMR, Kafka, Spark, Gurobi, or MySQL)\n\u2022 2\u002B year experience working on real-time data and streaming applications\n\u2022 2\u002B years of experience with NoSQL implementation (Mongo, Cassandra)\n\u2022 2\u002B years of data warehousing experience (Databricks or Snowflake)\n\u2022 3\u002B years of experience with UNIX/Linux including basic commands and shell scripting\n\u2022 2\u002B years of experience with Agile engineering practices\n\nAt this time, Capital One will not sponsor a new applicant for employment authorization for this position.\n\nThe minimum and maximum full-time annual salaries for this role are listed below, by location. Please note that this salary information is solely for candidates hired to perform work within one of these locations, and refers to the amount Capital One is willing to pay at the time of this posting. Salaries for part-time roles will be prorated based upon the agreed upon number of hours to be regularly worked. Remote (Regardless of Location): $144,200 - $164,600 for Senior Data EngineerRichmond, VA: $144,200 - $164,600 for Senior Data Engineer\n\nCandidates hired to work in other locations will be subject to the pay range associated with that location, and the actual annualized salary amount offered to any candidate at the time of hire will be reflected solely in the candidate\u0027s offer letter. This role is also eligible to earn performance based incentive compensation, which may include cash bonus(es) and/or long term incentives (LTI). Incentives could be discretionary or non discretionary depending on the plan.\n\nCapital One offers a comprehensive, competitive, and inclusive set of health, financial and other benefits that support your total well-being. Learn more at the Capital One Careers website . Eligibility varies based on full or part-time status, exempt or non-exempt status, and management level. This role is expected to accept applications for a minimum of 5 business days.No agencies please. Capital One is an equal opportunity employer committed to diversity and inclusion in the workplace. All qualified applicants will receive consideration for employment without regard to sex (including pregnancy, childbirth or related medical conditions), race, color, age, national origin, religion, disability, genetic information, marital status, sexual orientation, gender identity, gender reassignment, citizenship, immigration status, protected veteran status, or any other basis prohibited under applicable federal, state or local law. Capital One promotes a drug-free workplace. Capital One will consider for employment qualified applicants with a criminal history in a manner consistent with the requirements of applicable laws regarding criminal background inquiries, including, to the extent applicable, Article 23-A of the New York Correction Law; San Francisco, California Police Code Article 49, Sections 4901-4920; New York City\u0027s Fair Chance Act; Philadelphia\u0027s Fair Criminal Records Screening Act; and other applicable federal, state, and local laws and regulations regarding criminal background inquiries.\n\nIf you have visited our website in search of information on employment opportunities or to apply for a position, and you require an accommodation, please contact Capital One Recruiting at 1-800-304-9102 or via email at RecruitingAccommodation@capitalone.com . All information you provide will be kept confidential and will be used only to the extent required to provide needed reasonable accommodations.\n\nFor technical support or questions about Capital One\u0026s recruiting process, please send an email to Careers@capitalone.com\n\nCapital One does not provide, endorse nor guarantee and is not liable for third-party products, services, educational tools or other information available through this site.\n\nCapital One Financial is made up of several different entities. Please note that any position posted in Canada is for Capital One Canada, any position posted in the United Kingdom is for Capital One Europe and any position posted in the Philippines is for Capital One Philippines Service Corp. (COPSSC).",
  "Division": "Capital One Software",
  "Confidence": 95,
  "Reasoning": "The job description specifically mentions Capital One Software and describes products such as Slingshot and Databolt, both associated with Capital One Software, a division focused on building software solutions for cloud and data management.",
  "SourceLink": "https://www.google.com/search?ibp=htl;jobs\u0026q=Data\u002BEngineer\u0026htidocid=284K71Ri5qTuoTk8AAAAAA%3D%3D\u0026hl=en-US\u0026shndl=37\u0026shmd=H4sIAAAAAAAA_02NMQrCQBAAsc0TUm2pojkRbLQKKgEtBPOAsAmby8ll97hbMC_yncbOZpqBmeyzyO41sZMIF1SEK1vHRBG2cMbgFD08mKCWXt8YCZZPGkVpNfubtJAIYzeAMFQi1lN-GlRDOhqTki9sUlTXFZ2MRphamcxL2vRDk4Y5FzwqNfvDbioC23X-v3QMpXpkxQ1U5RebIGXEqQAAAA\u0026shmds=v1_AdeF8KiPjhPr4Tf63Q0i9OOxYo6nCOHKROZtGhJRkRGfCa7mUA\u0026source=sh/x/job/li/m1/1#fpstate=tldetail\u0026htivrt=jobs\u0026htiq=Data\u002BEngineer\u0026htidocid=284K71Ri5qTuoTk8AAAAAA%3D%3D",
  "SourceName": "Google Jobs",
  "JobHighlights": [
    {
      "title": "Qualifications",
      "items": [
        "Bachelor\u0027s Degree",
        "At least 3 years of experience in application development (Internship experience does not apply)",
        "At least 1 year of experience in big data technologies"
      ]
    },
    {
      "title": "Benefits",
      "items": [
        "Salaries for part-time roles will be prorated based upon the agreed upon number of hours to be regularly worked",
        "Remote (Regardless of Location): $144,200 - $164,600 for Senior Data EngineerRichmond, VA: $144,200 - $164,600 for Senior Data Engineer",
        "Candidates hired to work in other locations will be subject to the pay range associated with that location, and the actual annualized salary amount offered to any candidate at the time of hire will be reflected solely in the candidate\u0027s offer letter",
        "This role is also eligible to earn performance based incentive compensation, which may include cash bonus(es) and/or long term incentives (LTI)",
        "Incentives could be discretionary or non discretionary depending on the plan",
        "Capital One offers a comprehensive, competitive, and inclusive set of health, financial and other benefits that support your total well-being"
      ]
    },
    {
      "title": "Responsibilities",
      "items": [
        "As a Capital One Data Engineer you\u0027ll have the opportunity to be on the forefront of building this business and bring these tools to market",
        "Collaborate with and across Agile teams to design, develop, test, implement, and support technical solutions in full-stack development tools and technologies",
        "Work with a team of developers with deep experience in machine learning, distributed microservices, and full stack systems",
        "Utilize programming languages like Java, Scala, Python and Open Source RDBMS and NoSQL databases and Cloud based data warehousing services such as Databricks and Snowflake",
        "Share your passion for staying on top of tech trends, experimenting with and learning new technologies, participating in internal \u0026 external technology communities, and mentoring other members of the engineering community",
        "Collaborate with digital product managers, and deliver robust cloud-based solutions that drive powerful experiences to help millions of Americans achieve financial empowerment",
        "Perform unit tests and conduct reviews with other team members to make sure your code is rigorously designed, elegantly coded, and effectively tuned for performance"
      ]
    }
  ],
  "CreatedAt": "2025-07-30T07:50:29.8538252-04:00",
  "UpdatedAt": "2025-07-30T07:50:29.8538254-04:00"
}