{
  "Id": "cff28538-ac4a-4c88-bb6f-2d4bd3507fd0",
  "PostedDate": "2025-07-30T07:50:18.6352331-04:00",
  "JobId": "eyJqb2JfdGl0bGUiOiJTci4gU0RFVCDigJMgQUkgXHUwMDI2IERhdGEgRW5naW5lZXJpbmciLCJjb21wYW55X25hbWUiOiJMUEwgRmluYW5jaWFsIiwiYWRkcmVzc19jaXR5IjoiRm9ydCBNaWxsLCBTQyIsImh0aWRvY2lkIjoid3VQZnVSem9hZkNOcnpnOUFBQUFBQT09IiwidXVsZSI6IncrQ0FJUUlDSWFRMmhoY214dmRIUmxMRTVETEZWdWFYUmxaQ0JUZEdGMFpYTSIsImhsIjoiZW4ifQ==",
  "CompanyId": "0fc4df6d32de3f01e181801b36a8a035723467f709f8792368cc281e8b6fc452",
  "CompanyName": "LPL Financial",
  "HiringAgency": "LPL Financial",
  "JobTitle": "Sr. SDET \u2013 AI \u0026 Data Engineering",
  "Location": "Fort Mill, SC",
  "JobDescription": "Job Overview:\n\nOur team is actively seeking a motivated and talented Sr. Software Development Engineer in Test who is passionate about data and testing software through automation. You will be part of an inter-disciplinary team of hardware, firmware, software, system, and test engineers to develop and integrate cutting-edge technologies for a Financial Services Company, building AI driven E2E automation solutions connecting the Advisor Platform, the Investor Platform, and Teammates.\n\nYou will work closely with product and engineering teams to understand features, develop and automate test cases, improve product quality, and shorten release time from development to production.\n\nResponsibilities:\n\u2022 Actively Participate in all Agile Scrum ceremonies - PI Planning, Sprint Planning, Daily Standups, Defect Review, Sprint Demo, Retrospective\n\u2022 Actively participate in Backlog Refinement, story grooming, analyze and understand user story acceptance criteria\n\u2022 Develop and execute both Manual and Automation Test plan, Test Cases based on the user stories and ensure proper test coverage\n\u2022 Identify manual processes and implement intelligent automation solutions using AI/ML frameworks to optimize overall test preparation and execution efficiency also reduce cycle time.\n\u2022 Perform in-sprint testing, service/API testing, Integration / E2E testing, Regression Final Build Certification and Release Day testing\n\u2022 Reviewing user interfaces for conformity and functionality\n\u2022 Working with software engineers to understand product architecture, integrations and features\n\u2022 Creating and maintaining data scenarios to support test plans and test cases\n\u2022 Ability to identify patterns, anomalies, and inconsistencies within data, ensuring accuracy and quality.\n\u2022 Analyzing test results, being a vocal proponent for quality in every phase of the development process\n\u2022 Documenting, tracking bugs to closure and reports on Project status to stakeholders\n\u2022 Working in an Agile/Scrum environment to deliver high-quality software\n\u2022 Serves as SME for one or more functional areas, acts as technology ambassador for automation and builds efficient solutions\n\nRequirements:\n\u2022 Bachelor\u2019s degree in computer science or related field, plus 6\u002B years of IT experience, or a Master\u2019s degree with 5\u002B years of IT experience\n\u2022 Minimum of 6\u002B years of hands-on experience in software development in test automation SDET, concurrent coding skills in one of the programming languages: Java or Python\n\u2022 Test automation experience using open-source technologies and/or in-house frameworks like Selenium, Appium, TestNG, etc., and have leveraged \u0026 implemented CI/CD pipelines\n\u2022 Hands-on experience with test processes, test methodologies, test strategy, test plan and test case design \u0026 execution\n\n\u200B\n\nTechnical Requirements\n\u2022 Solid experience in testing SQL procedures and the ability to understand/write complex SQL queries to perform data validation\n\u2022 Hands-on experience creating and executing test plans, test cases, and test scripts for Database/ETL Workflows\n\u2022 Minimum of 2 years of hands-on experience working with AWS services like S3, RDS, DynamoDB, Lambda, and exposure to Bedrock model integration or experience with other cloud vendors\n\u2022 AI Tools / Models / Training Data Set exposure is a plus for adoption in testing methodologies\n\u2022 Hands-on experience analyzing data, comparing with mapping documents, and debugging to identify the root cause\n\u2022 Familiarity with Docker and Kubernetes; Snowflake and Data Lake\n\u2022 Hands-on experience Testing and Automation development for Batch Jobs, Data Feeds, API / Web services / Swagger\n\u2022 Experience with test frameworks like Junit, TestNG; Code Versioning tools like GIT\n\u2022 Experience with CI/CD with TeamCity/Octopus/Jenkins; and integrate AI-based quality gates and observability into CI/CD pipelines like GitHub Co-pilot\n\u2022 Envision opportunities and apply AI low code/ no code automation techniques to improve the test coverage\n\u2022 Experience with Jira or similar Agile process tools\n\nPreferences:\n\u2022 Cloud certification(s) are a plus\n\u2022 Gen AI hands on around Test preparation, data generation, and automation solutions\n\u2022 Financial Industry experience\n\u2022 Ability to thrive in a fast-paced environment where resourcefulness, determination, and strong problem-solving skills are necessary for success\n\u2022 Positive attitude and ability to take ownership of releases / features / stories / tasks to deliver with quality\n\u2022 This role is a hybrid position and must report into an LPL primary office either in Austin, TX or Charlotte/Fort Mill, SC.\n\nPay Range:\n$91,425-$152,375/year\n\nActual base salary varies based on factors, including but not limited to, relevant skill, prior experience, education, base salary of internal peers, demonstrated performance, and geographic location. Additionally, LPL Total Rewards package is highly competitive, designed to support your success at work, at home, and at play \u2013 such as 401K matching, health benefits, employee stock options, paid time off, volunteer time off, and more. Your recruiter will be happy to discuss all that LPL has to offer!\n\nCompany Overview:\n\nLPL Financial Holdings Inc. (Nasdaq: LPLA) was founded on the principle that the firm should work for advisors and institutions, and not the other way around. Today, LPL is a leader in the markets we serve, serving more than 23,000 financial advisors, including advisors at approximately 1,000 institutions and at approximately 580 registered investment advisor (\u0022RIA\u0022) firms nationwide. We are steadfast in our commitment to the advisor-mediated model and the belief that Americans deserve access to personalized guidance from a financial professional.\n\nAt LPL, independence means that advisors and institution leaders have the freedom they deserve to choose the business model, services, and technology resources that allow them to run a thriving business. They have the flexibility to do business their way. And they have the freedom to manage their client relationships, because they know their clients best. Simply put, we take care of our advisors and institutions, so they can take care of their clients.\n\nJoin LPL Financial: Where Your Potential Meets Opportunity\n\nAt LPL Financial, we believe that everyone deserves objective financial guidance. As the nation\u2019s leading independent broker-dealer, we offer an integrated platform of cutting-edge technology, brokerage, and investment advisor services.\n\nWhy LPL?\n\u2022 Innovative Environment: We foster creativity and growth, providing a supportive and responsive leadership team. Learn more about our leadership team here!\n\u2022 Limitless Career Potential: Your career at LPL has no limits, only amazing potential. Learn more about our careers here!\n\u2022 Unified Mission: We are one team on one mission\u2014taking care of our advisors so they can take care of their clients. Learn more about our mission and values here!\n\u2022 Impactful Work: Our size is just right for you to make a real impact. Learn more here!\n\u2022 Commitment to Equality: We support workplace equality and embrace diverse perspectives and backgrounds. Learn more here!\n\u2022 Community Focus: We care for our communities and encourage our employees to do the same. Learn more here!\n\u2022 Benefits and Total Rewards: Our Total Rewards package goes beyond just compensation and insurance. It includes a mix of traditional and unique benefits, perks, and resources designed to enhance your life both at work and at home. Learn more here!\n\nJoin the LPL team and help us make a difference by turning life\u2019s aspirations into financial realities. Please log in or create an account to apply to this position. Principals only. EOE.\n\nInformation on Interviews:\n\nLPL will only communicate with a job applicant directly from an @lplfinancial.com email address and will never conduct an interview online or in a chatroom forum. During an interview, LPL will not request any form of payment from the applicant, or information regarding an applicant\u2019s bank or credit card. Should you have any questions regarding the application process, please contact LPL\u2019s Human Resources Solutions Center at (855) 575-6947.\n\nEAC1.22.25",
  "Division": "Technology and Innovation",
  "Confidence": 85,
  "Reasoning": "The job involves developing AI-driven automation solutions and working with cutting-edge technologies, suggesting it falls under the Technology and Innovation division within LPL Financial.",
  "SourceLink": "https://www.google.com/search?ibp=htl;jobs\u0026q=Data\u002BEngineer\u0026htidocid=wuPfuRzoafCNrzg9AAAAAA%3D%3D\u0026hl=en-US\u0026shndl=37\u0026shmd=H4sIAAAAAAAA_xXEMQrCMBQGYFx7BAf5JwfRRAQHdRLbiqIg1L28lpBG4nslydDRO7h4Pk8ifsOXfUbZpgoKVV7c8X29sT9hipwSoWDr2Jjg2GKBszSIhkLbQRhHEevNeNel1Met1jF6ZWOi5FrVylMLm0YG_ZAm_qtjR8H0npKpV-vloHq2s8nldkHpmLh15OEYpYSEq_N-jurwA4N0JnCbAAAA\u0026shmds=v1_AdeF8KgaKt5B1VP2vZ2eDgo7uf7fk8XytlE1EHXOhrDPinB6yA\u0026source=sh/x/job/li/m1/1#fpstate=tldetail\u0026htivrt=jobs\u0026htiq=Data\u002BEngineer\u0026htidocid=wuPfuRzoafCNrzg9AAAAAA%3D%3D",
  "SourceName": "Google Jobs",
  "JobHighlights": [
    {
      "title": "Qualifications",
      "items": [
        "Bachelor\u2019s degree in computer science or related field, plus 6\u002B years of IT experience, or a Master\u2019s degree with 5\u002B years of IT experience",
        "Minimum of 6\u002B years of hands-on experience in software development in test automation SDET, concurrent coding skills in one of the programming languages: Java or Python",
        "Test automation experience using open-source technologies and/or in-house frameworks like Selenium, Appium, TestNG, etc., and have leveraged \u0026 implemented CI/CD pipelines",
        "Hands-on experience with test processes, test methodologies, test strategy, test plan and test case design \u0026 execution",
        "Solid experience in testing SQL procedures and the ability to understand/write complex SQL queries to perform data validation",
        "Hands-on experience creating and executing test plans, test cases, and test scripts for Database/ETL Workflows",
        "Minimum of 2 years of hands-on experience working with AWS services like S3, RDS, DynamoDB, Lambda, and exposure to Bedrock model integration or experience with other cloud vendors",
        "Hands-on experience analyzing data, comparing with mapping documents, and debugging to identify the root cause",
        "Familiarity with Docker and Kubernetes; Snowflake and Data Lake",
        "Hands-on experience Testing and Automation development for Batch Jobs, Data Feeds, API / Web services / Swagger",
        "Experience with test frameworks like Junit, TestNG; Code Versioning tools like GIT",
        "Experience with CI/CD with TeamCity/Octopus/Jenkins; and integrate AI-based quality gates and observability into CI/CD pipelines like GitHub Co-pilot",
        "Envision opportunities and apply AI low code/ no code automation techniques to improve the test coverage",
        "Experience with Jira or similar Agile process tools",
        "Gen AI hands on around Test preparation, data generation, and automation solutions",
        "Financial Industry experience",
        "Ability to thrive in a fast-paced environment where resourcefulness, determination, and strong problem-solving skills are necessary for success",
        "Positive attitude and ability to take ownership of releases / features / stories / tasks to deliver with quality",
        "This role is a hybrid position and must report into an LPL primary office either in Austin, TX or Charlotte/Fort Mill, SC"
      ]
    },
    {
      "title": "Benefits",
      "items": [
        "$91,425-$152,375/year",
        "Actual base salary varies based on factors, including but not limited to, relevant skill, prior experience, education, base salary of internal peers, demonstrated performance, and geographic location",
        "Additionally, LPL Total Rewards package is highly competitive, designed to support your success at work, at home, and at play \u2013 such as 401K matching, health benefits, employee stock options, paid time off, volunteer time off, and more",
        "Innovative Environment: We foster creativity and growth, providing a supportive and responsive leadership team",
        "Benefits and Total Rewards: Our Total Rewards package goes beyond just compensation and insurance",
        "It includes a mix of traditional and unique benefits, perks, and resources designed to enhance your life both at work and at home"
      ]
    },
    {
      "title": "Responsibilities",
      "items": [
        "You will be part of an inter-disciplinary team of hardware, firmware, software, system, and test engineers to develop and integrate cutting-edge technologies for a Financial Services Company, building AI driven E2E automation solutions connecting the Advisor Platform, the Investor Platform, and Teammates",
        "You will work closely with product and engineering teams to understand features, develop and automate test cases, improve product quality, and shorten release time from development to production",
        "Actively Participate in all Agile Scrum ceremonies - PI Planning, Sprint Planning, Daily Standups, Defect Review, Sprint Demo, Retrospective",
        "Actively participate in Backlog Refinement, story grooming, analyze and understand user story acceptance criteria",
        "Develop and execute both Manual and Automation Test plan, Test Cases based on the user stories and ensure proper test coverage",
        "Identify manual processes and implement intelligent automation solutions using AI/ML frameworks to optimize overall test preparation and execution efficiency also reduce cycle time",
        "Perform in-sprint testing, service/API testing, Integration / E2E testing, Regression Final Build Certification and Release Day testing",
        "Reviewing user interfaces for conformity and functionality",
        "Working with software engineers to understand product architecture, integrations and features",
        "Creating and maintaining data scenarios to support test plans and test cases",
        "Ability to identify patterns, anomalies, and inconsistencies within data, ensuring accuracy and quality",
        "Analyzing test results, being a vocal proponent for quality in every phase of the development process",
        "Documenting, tracking bugs to closure and reports on Project status to stakeholders",
        "Working in an Agile/Scrum environment to deliver high-quality software",
        "Serves as SME for one or more functional areas, acts as technology ambassador for automation and builds efficient solutions"
      ]
    }
  ],
  "CreatedAt": "2025-07-30T07:50:18.6352418-04:00",
  "UpdatedAt": "2025-07-30T07:50:18.6352422-04:00"
}