{
  "Id": "44f23588-d676-4915-af71-01ad00d00be2",
  "PostedDate": "2025-07-27T23:33:03.6334933Z",
  "JobId": "eyJqb2JfdGl0bGUiOiJMZWFkIERhdGEgRW5naW5lZXIiLCJjb21wYW55X25hbWUiOiJBaG9sZCBEZWxoYWl6ZSBVU0EgLSBQUk9EIiwiYWRkcmVzc19jaXR5IjoiU2FsaXNidXJ5LCBOQyIsImh0aWRvY2lkIjoiQ3YtVUQ1bG95TVN5cDkyUUFBQUFBQT09IiwidXVsZSI6IncrQ0FJUUlDSWFRMmhoY214dmRIUmxMRTVETEZWdWFYUmxaQ0JUZEdGMFpYTSIsImhsIjoiZW4ifQ==",
  "CompanyId": "Ahold Delhaize USA - PROD",
  "CompanyName": "Ahold Delhaize USA - PROD",
  "HiringAgency": "Kaplan Community Career Center",
  "JobTitle": "Lead Data Engineer",
  "Location": "Salisbury, NC",
  "JobDescription": "Category/Area of Expertise: IT \u0026 Technology\nJob Requisition: 395940\nAddress: USA-NC-Salisbury-2110 Executive Drive\nStore Code: Architecture, Strategy \u0026 Developmen (5119305)\n\nAhold Delhaize USA, a division of global food retailer Ahold Delhaize, is part of the U.S. family of brands, which includes five leading omnichannel grocery brands - Food Lion, Giant Food, The GIANT Company, Hannaford and Stop \u0026 Shop. Our associates support the brands with a wide range of services, including Finance, Legal, Sustainability, Commercial, Digital and E-commerce, Technology and more.\n\nThe Lead Data Engineer will be responsible for expanding and optimizing our data and data pipeline architecture, as well as optimizing data flow and collection for cross functional teams. They will drive our data initiatives and will ensure optimal data delivery architecture is consistent throughout ongoing projects. They engage through the entire lifecycle of a project from data mapping, data pipelines, data modeling, and finally data consumption. They must be self-directed and comfortable supporting teh data needs of multiple teams, systems and products. They will proactively optimize or even assist with the design of our company\u0027s data archictecture to support our next generation of products and data initiatives. They will work on various ambiguous and complex issues, where analysis of situations or data requires an in-depth evaluation of variable factors, thorough understnding of the business strategy, operations, markets and key stakeholders.\n\nOur flexible/ hybrid work schedule includes 3 in-person days at one of our core locations and 2 remote days. Our core office locations include Salisbury, NC and Quincy, MA.\n\nApplicants must be currently authorized to work in the United States on a full-time basis.\n\nDuties \u0026 Responsibilities:\n\u2022 Solves complex application errors, designs, and resolves application problems, following up promptly with all appropriate customers and IT personnel.\n\u2022 Validates QA test plans and supports QA team during test execution.\n\u2022 Designs and develops data transformations and data pipelines.\n\u2022 Ensures and signs off on change control and change management procedures are followed within the program/project as they relate to requirements.\n\u2022 Designs and develops BI datasets for reports and dashboards to support decision-making within business and IT.\n\u2022 Create requirement documents, create functional design documents, and review the functional design documents created by vendor partners as a part of software development life cycle.\n\u2022 Documents all phases of work including gathering requirements, joining relationship diagrams, creating database diagrams, report layouts and other program technical specifications using current specified design standards for new or revised solutions.\n\u2022 Relates information from various sources to draw logical conclusions.\n\u2022 Conducts unit testing on ELT and report development.\n\u2022 Conducts data lineage and impact analysis as a part of the change management process.\n\u2022 Conducts data analysis (SQL, Excel, Data Discovery, etc.) on legacy systems and new data sources.\n\u2022 Documents reporting requirements through engagement with business process SMEs.\n\u2022 Creates and approves source to target data mappings for data pipelines and integration activities.\n\u2022 Identifies and resolves the impact of proposed application development/enhancements projects.\n\u2022 Performs data profiling and process analysis to understand key source systems and uses knowledge of application features and functions to assess scope and impact of business needs.\n\u2022 Works with business users to design, develop, test, and implement business intelligence solutions in the Data \u0026 Analytics Platform.\n\u2022 Assists in assessing alternative software solutions for workability and technical feasibility.\n\u2022 Work closely with business teams in every stage from gathering requirements to closure of project.\n\u2022 Work with the key stakeholders to create requirements for each business solution, ensure the requirements are developed in concert with and agreed upon by the business partner, and that the solution delivers the agreed upon business needs.\n\u2022 Implement and maintain data governance policies and procedures to ensure data quality, security and compliance.\n\u2022 Initiates and leads workstreams for improving way of working in teams, eliminating technical debt and optimizing business processes.\n\u2022 Acts as a subject matter expert on technology solution.\n\u2022 Responsible for coaching/mentoring/leading junior engineers.\n\u2022 Consistently delivers very high-quality work in cross-functional environments - seen as an expert and technical leader among peers.\n\u2022 Has a balanced approach to team empowerment and leadership driving successful brainstorming sessions and solid technical conclusions to work approaches while modeling self-accountability, continuous development and team contributions.\n\u2022 Remain up to date on emerging technologies and best practices in data engineering. Recommend new approaches to improving data infrastructure.\n\nQualifications:\n\u2022 Bachelors Degree in Computer Science or Technical field and Masters Degree in Technology and/or Business related field; equivalent trainings/certifications/experience equivalency will be considered\n\u2022 8 or more years of equivalent experience in relevant job or field of technology\n\u2022 2 or more years of equivalent experience in an advanced role or technical capacity, leading teams directly or indirectly\n\u2022 2 or more years experience directly responsible for guiding, training or onboarding team members in relevant technologies, capabilities or skills\n\u2022 Experience with some or all of the following: Azure Data Factory, Databricks, Kafka, Java spring boot/Python and CI/CD DevOps\nPreferred Qualifications:\n\u2022 Post graduate degree advanced training and or certifications in relevant field/s of study preferred\n\u2022 3 or more years experience in Agile teams and Product/Platform based operating model.\n\u2022 3 or more years of experience in leading teams or advancing technical capability in teams.\n\u2022 Experience in retail or grocery preferred.\n\nSalary Range: $142,000 - $220,440\n\n#DICEJobs\n\n#LI-hybrid\n\n#LI-SS1\n\nAt Ahold Delhaize USA, we provide services to one of the largest portfolios of grocery companies in the nation, and we\u0027re actively seeking top talent. Our team shares a common motivation to drive change, take ownership and enable our brands to better care for their customers. We thrive on supporting great local grocery brands and their strategies.\n\nWe offer an experience where our associates are valued; Diversity, Equity, Inclusion and Belonging are infused in our business and our employees are representative of the communities that we serve. We believe in total wellness, which encompasses a blend of physical, financial and emotional wellness.\n\nWe believe in collaboration, curiosity, and continuous learning in all that we think, create and do. While building a culture where personal and professional growth are just as important as business growth, we invest in our people, empowering them to learn, grow and deliver at all levels of the business.",
  "Division": "Technology",
  "Confidence": 90,
  "Reasoning": "The job description indicates a focus on data engineering, technology solutions, and IT tasks, which aligns with the responsibilities typically handled by a Technology division.",
  "SourceLink": "https://www.google.com/search?ibp=htl;jobs\u0026q=Data\u002BEngineer\u0026htidocid=Cv-UD5loyMSyp92QAAAAAA%3D%3D\u0026hl=en-US\u0026shndl=37\u0026shmd=H4sIAAAAAAAA_xXNsQrCMBAAUFz7CU63WrQRwUWnYkUQUbE4l0t7JJGYK7kI1e_wg63LW1_2nWSzE2EHFSaEfTAuEEVYwJE1CGFsLXCAA7PxNN3alHrZKCXiCyMJk2uLlp-KA2ke1IO1_GnEYqTeY6JmtV4ORR9MnpeW_RiRt-g-BPe6HJ_r7VKBC1Cjd6Jf8T2H8-4HGVTIUpcAAAA\u0026shmds=v1_AdeF8Kjrj1cUGvOT3IcTruK-LGCaH5UulxbKou4Y0r9fzFlk6w\u0026source=sh/x/job/li/m1/1#fpstate=tldetail\u0026htivrt=jobs\u0026htiq=Data\u002BEngineer\u0026htidocid=Cv-UD5loyMSyp92QAAAAAA%3D%3D",
  "SourceName": "Google Jobs",
  "JobHighlights": [
    {
      "title": "Qualifications",
      "items": [
        "Applicants must be currently authorized to work in the United States on a full-time basis",
        "Bachelors Degree in Computer Science or Technical field and Masters Degree in Technology and/or Business related field; equivalent trainings/certifications/experience equivalency will be considered",
        "8 or more years of equivalent experience in relevant job or field of technology",
        "2 or more years of equivalent experience in an advanced role or technical capacity, leading teams directly or indirectly",
        "2 or more years experience directly responsible for guiding, training or onboarding team members in relevant technologies, capabilities or skills",
        "Experience with some or all of the following: Azure Data Factory, Databricks, Kafka, Java spring boot/Python and CI/CD DevOps"
      ]
    },
    {
      "title": "Benefits",
      "items": [
        "Salary Range: $142,000 - $220,440"
      ]
    },
    {
      "title": "Responsibilities",
      "items": [
        "The Lead Data Engineer will be responsible for expanding and optimizing our data and data pipeline architecture, as well as optimizing data flow and collection for cross functional teams",
        "They will drive our data initiatives and will ensure optimal data delivery architecture is consistent throughout ongoing projects",
        "They engage through the entire lifecycle of a project from data mapping, data pipelines, data modeling, and finally data consumption",
        "They must be self-directed and comfortable supporting teh data needs of multiple teams, systems and products",
        "They will proactively optimize or even assist with the design of our company\u0027s data archictecture to support our next generation of products and data initiatives",
        "They will work on various ambiguous and complex issues, where analysis of situations or data requires an in-depth evaluation of variable factors, thorough understnding of the business strategy, operations, markets and key stakeholders",
        "Solves complex application errors, designs, and resolves application problems, following up promptly with all appropriate customers and IT personnel",
        "Validates QA test plans and supports QA team during test execution",
        "Designs and develops data transformations and data pipelines",
        "Ensures and signs off on change control and change management procedures are followed within the program/project as they relate to requirements",
        "Designs and develops BI datasets for reports and dashboards to support decision-making within business and IT",
        "Create requirement documents, create functional design documents, and review the functional design documents created by vendor partners as a part of software development life cycle",
        "Documents all phases of work including gathering requirements, joining relationship diagrams, creating database diagrams, report layouts and other program technical specifications using current specified design standards for new or revised solutions",
        "Relates information from various sources to draw logical conclusions",
        "Conducts unit testing on ELT and report development",
        "Conducts data lineage and impact analysis as a part of the change management process",
        "Conducts data analysis (SQL, Excel, Data Discovery, etc.) on legacy systems and new data sources",
        "Documents reporting requirements through engagement with business process SMEs",
        "Creates and approves source to target data mappings for data pipelines and integration activities",
        "Identifies and resolves the impact of proposed application development/enhancements projects",
        "Performs data profiling and process analysis to understand key source systems and uses knowledge of application features and functions to assess scope and impact of business needs",
        "Works with business users to design, develop, test, and implement business intelligence solutions in the Data \u0026 Analytics Platform",
        "Assists in assessing alternative software solutions for workability and technical feasibility",
        "Work closely with business teams in every stage from gathering requirements to closure of project",
        "Work with the key stakeholders to create requirements for each business solution, ensure the requirements are developed in concert with and agreed upon by the business partner, and that the solution delivers the agreed upon business needs",
        "Implement and maintain data governance policies and procedures to ensure data quality, security and compliance",
        "Initiates and leads workstreams for improving way of working in teams, eliminating technical debt and optimizing business processes",
        "Acts as a subject matter expert on technology solution",
        "Responsible for coaching/mentoring/leading junior engineers",
        "Consistently delivers very high-quality work in cross-functional environments - seen as an expert and technical leader among peers",
        "Has a balanced approach to team empowerment and leadership driving successful brainstorming sessions and solid technical conclusions to work approaches while modeling self-accountability, continuous development and team contributions",
        "Remain up to date on emerging technologies and best practices in data engineering",
        "Recommend new approaches to improving data infrastructure"
      ]
    }
  ],
  "CreatedAt": "2025-07-27T23:33:03.6334939Z",
  "UpdatedAt": "2025-07-27T23:33:03.6334939Z"
}